cwe_id,name,score,search_source
116,Improper Encoding or Escaping of Output,8672.854710453856,base_query
79,Improper Neutralization of Input During Web Page Generation ('Cross-site Scripting'),8420.986014896753,base_query
113,Improper Neutralization of CRLF Sequences in HTTP Headers ('HTTP Request/Response Splitting'),8403.418210040769,base_query
138,Improper Neutralization of Special Elements,8311.133877787135,base_query
88,Improper Neutralization of Argument Delimiters in a Command ('Argument Injection'),7989.983448505237,base_query
