cwe_id,name,score,search_source
184,Incomplete List of Disallowed Inputs,6837.78864653113,base_query
88,Improper Neutralization of Argument Delimiters in a Command ('Argument Injection'),6797.1096773708205,base_query
22,Improper Limitation of a Pathname to a Restricted Directory ('Path Traversal'),6742.0932389938025,base_query
78,Improper Neutralization of Special Elements used in an OS Command ('OS Command Injection'),6723.55901371161,base_query
259,Use of Hard-coded Password,6706.835734839968,base_query
