cwe_id,name,score,search_source
1336,Improper Neutralization of Special Elements Used in a Template Engine,7156.991746790297,unknown
917,Improper Neutralization of Special Elements used in an Expression Language Statement ('Expression Language Injection'),6966.124324771631,unknown
116,Improper Encoding or Escaping of Output,6939.147225007863,unknown
611,Improper Restriction of XML External Entity Reference,6921.69516684871,unknown
22,Improper Limitation of a Pathname to a Restricted Directory ('Path Traversal'),6783.711746081916,unknown
