cwe_id,name,score,search_source
79,Improper Neutralization of Input During Web Page Generation ('Cross-site Scripting'),8036.134872619539,base_query
116,Improper Encoding or Escaping of Output,7833.772200269206,base_query
942,Permissive Cross-domain Policy with Untrusted Domains,7556.415842400526,base_query
352,Cross-Site Request Forgery (CSRF),7349.322608511724,base_query
113,Improper Neutralization of CRLF Sequences in HTTP Headers ('HTTP Request/Response Splitting'),7209.770920587222,base_query
