cwe_id,name,score,search_source
1336,Improper Neutralization of Special Elements Used in a Template Engine,7023.242416421789,unknown
88,Improper Neutralization of Argument Delimiters in a Command ('Argument Injection'),6810.038553198293,unknown
917,Improper Neutralization of Special Elements used in an Expression Language Statement ('Expression Language Injection'),6751.706608380283,unknown
116,Improper Encoding or Escaping of Output,6711.787026429299,unknown
94,Improper Control of Generation of Code ('Code Injection'),6582.4197796625485,unknown
