cwe_id,name,score,search_source
116,Improper Encoding or Escaping of Output,7407.441209960056,unknown
1336,Improper Neutralization of Special Elements Used in a Template Engine,7322.875853188377,unknown
88,Improper Neutralization of Argument Delimiters in a Command ('Argument Injection'),7102.290833795668,unknown
184,Incomplete List of Disallowed Inputs,7090.738254913723,unknown
74,Improper Neutralization of Special Elements in Output Used by a Downstream Component ('Injection'),6958.215047364271,unknown
