cwe_id,name,score,search_source
113,Improper Neutralization of CRLF Sequences in HTTP Headers ('HTTP Request/Response Splitting'),9588.201613915273,unknown
116,Improper Encoding or Escaping of Output,9364.604444757484,unknown
79,Improper Neutralization of Input During Web Page Generation ('Cross-site Scripting'),9252.795385000234,unknown
138,Improper Neutralization of Special Elements,9085.515937194863,unknown
93,Improper Neutralization of CRLF Sequences ('CRLF Injection'),8918.750445549636,unknown
