cwe_id,name,score,search_source
116,Improper Encoding or Escaping of Output,9954.3970008425,unknown
79,Improper Neutralization of Input During Web Page Generation ('Cross-site Scripting'),9668.781439705153,unknown
22,Improper Limitation of a Pathname to a Restricted Directory ('Path Traversal'),9553.915719933919,unknown
1336,Improper Neutralization of Special Elements Used in a Template Engine,9302.794630937038,unknown
639,Authorization Bypass Through User-Controlled Key,9275.686811490365,unknown
