cwe_id,name,score,search_source
88,Improper Neutralization of Argument Delimiters in a Command ('Argument Injection'),6262.2315655450875,base_query
639,Authorization Bypass Through User-Controlled Key,5955.911635919871,base_query
116,Improper Encoding or Escaping of Output,5861.355964411015,base_query
22,Improper Limitation of a Pathname to a Restricted Directory ('Path Traversal'),5743.061363832533,base_query
472,External Control of Assumed-Immutable Web Parameter,5738.3747161847705,base_query
