cwe_id,name,score,search_source
88,Improper Neutralization of Argument Delimiters in a Command ('Argument Injection'),6118.246874474731,base_query
95,Improper Neutralization of Directives in Dynamically Evaluated Code ('Eval Injection'),6095.020848852274,base_query
94,Improper Control of Generation of Code ('Code Injection'),6048.072766149289,base_query
22,Improper Limitation of a Pathname to a Restricted Directory ('Path Traversal'),6044.094876116488,base_query
427,Uncontrolled Search Path Element,6042.949616820296,base_query
