cwe_id,name,score,search_source
335,Incorrect Usage of Seeds in Pseudo-Random Number Generator (PRNG),5607.744349176659,unknown
113,Improper Neutralization of CRLF Sequences in HTTP Headers ('HTTP Request/Response Splitting'),5518.9046125299255,unknown
1321,Improperly Controlled Modification of Object Prototype Attributes ('Prototype Pollution'),5437.3188932977355,unknown
1333,Inefficient Regular Expression Complexity,5369.844784490141,unknown
639,Authorization Bypass Through User-Controlled Key,5278.294976611121,unknown
