cwe_id,name,score,search_source
79,Improper Neutralization of Input During Web Page Generation ('Cross-site Scripting'),7603.465076591763,unknown
113,Improper Neutralization of CRLF Sequences in HTTP Headers ('HTTP Request/Response Splitting'),7551.797078481767,unknown
116,Improper Encoding or Escaping of Output,7139.834270229699,unknown
1336,Improper Neutralization of Special Elements Used in a Template Engine,7081.871012072019,unknown
138,Improper Neutralization of Special Elements,6897.267711277452,unknown
