cwe_id,name,score,search_source
116,Improper Encoding or Escaping of Output,6886.19438508587,base_query
917,Improper Neutralization of Special Elements used in an Expression Language Statement ('Expression Language Injection'),6866.292251418361,base_query
138,Improper Neutralization of Special Elements,6810.649884619943,base_query
22,Improper Limitation of a Pathname to a Restricted Directory ('Path Traversal'),6743.214538791382,base_query
95,Improper Neutralization of Directives in Dynamically Evaluated Code ('Eval Injection'),6723.532653630191,base_query
