cwe_id,name,score,search_source
79,Improper Neutralization of Input During Web Page Generation ('Cross-site Scripting'),9214.910994907643,base_query
113,Improper Neutralization of CRLF Sequences in HTTP Headers ('HTTP Request/Response Splitting'),9126.04011297933,base_query
116,Improper Encoding or Escaping of Output,8989.202438792476,base_query
88,Improper Neutralization of Argument Delimiters in a Command ('Argument Injection'),8784.95796130845,base_query
611,Improper Restriction of XML External Entity Reference,8709.239198376157,base_query
