cwe_id,name,score,search_source
1336,Improper Neutralization of Special Elements Used in a Template Engine,8442.279592357185,base_query
22,Improper Limitation of a Pathname to a Restricted Directory ('Path Traversal'),8297.850716572064,base_query
116,Improper Encoding or Escaping of Output,8225.387934631715,base_query
88,Improper Neutralization of Argument Delimiters in a Command ('Argument Injection'),8222.641437913877,base_query
138,Improper Neutralization of Special Elements,8190.186389613622,base_query
