cwe_id,name,score,search_source
79,Improper Neutralization of Input During Web Page Generation ('Cross-site Scripting'),7532.232773730042,base_query
116,Improper Encoding or Escaping of Output,7157.65461353262,base_query
1336,Improper Neutralization of Special Elements Used in a Template Engine,7037.689824246707,base_query
434,Unrestricted Upload of File with Dangerous Type,6918.953247505271,base_query
22,Improper Limitation of a Pathname to a Restricted Directory ('Path Traversal'),6838.382105204801,base_query
