cwe_id,name,score,search_source
116,Improper Encoding or Escaping of Output,9545.168417292958,base_query
79,Improper Neutralization of Input During Web Page Generation ('Cross-site Scripting'),9369.263011065628,base_query
113,Improper Neutralization of CRLF Sequences in HTTP Headers ('HTTP Request/Response Splitting'),9332.595685357324,base_query
138,Improper Neutralization of Special Elements,8825.072342837348,base_query
22,Improper Limitation of a Pathname to a Restricted Directory ('Path Traversal'),8634.98162161651,base_query
