cwe_id,name,score,search_source
116,Improper Encoding or Escaping of Output,9880.46877005288,unknown
88,Improper Neutralization of Argument Delimiters in a Command ('Argument Injection'),9734.529619837147,unknown
79,Improper Neutralization of Input During Web Page Generation ('Cross-site Scripting'),9555.878524626356,unknown
1336,Improper Neutralization of Special Elements Used in a Template Engine,9452.11420362616,unknown
138,Improper Neutralization of Special Elements,9405.98568948571,unknown
