cwe_id,name,score,search_source
113,Improper Neutralization of CRLF Sequences in HTTP Headers ('HTTP Request/Response Splitting'),7206.410804035656,unknown
444,Inconsistent Interpretation of HTTP Requests ('HTTP Request/Response Smuggling'),6901.388722994603,unknown
22,Improper Limitation of a Pathname to a Restricted Directory ('Path Traversal'),6585.989976358383,unknown
93,Improper Neutralization of CRLF Sequences ('CRLF Injection'),6360.988157660903,unknown
1333,Inefficient Regular Expression Complexity,6316.118598251824,unknown
