cwe_id,name,score,search_source
790,Improper Filtering of Special Elements,6650.805596299796,base_query
88,Improper Neutralization of Argument Delimiters in a Command ('Argument Injection'),6080.828225561883,base_query
78,Improper Neutralization of Special Elements used in an OS Command ('OS Command Injection'),6067.669866683068,base_query
138,Improper Neutralization of Special Elements,5984.229431029978,base_query
22,Improper Limitation of a Pathname to a Restricted Directory ('Path Traversal'),5904.7928891704,base_query
