cwe_id,name,score,search_source
88,Improper Neutralization of Argument Delimiters in a Command ('Argument Injection'),6665.357302190582,unknown
184,Incomplete List of Disallowed Inputs,6372.835956017804,unknown
116,Improper Encoding or Escaping of Output,6230.496974059171,unknown
95,Improper Neutralization of Directives in Dynamically Evaluated Code ('Eval Injection'),6197.41792903918,unknown
78,Improper Neutralization of Special Elements used in an OS Command ('OS Command Injection'),6178.917216359154,unknown
