cwe_id,name,score,search_source
451,User Interface (UI) Misrepresentation of Critical Information,10303.452412354967,base_query
79,Improper Neutralization of Input During Web Page Generation ('Cross-site Scripting'),9956.035433410212,base_query
22,Improper Limitation of a Pathname to a Restricted Directory ('Path Traversal'),9908.642756227555,base_query
116,Improper Encoding or Escaping of Output,9730.613792028907,base_query
1336,Improper Neutralization of Special Elements Used in a Template Engine,9634.176840765087,base_query
