cwe_id,name,score,search_source
184,Incomplete List of Disallowed Inputs,6604.346313660499,unknown
88,Improper Neutralization of Argument Delimiters in a Command ('Argument Injection'),6600.8811665920275,unknown
95,Improper Neutralization of Directives in Dynamically Evaluated Code ('Eval Injection'),6592.725240308048,unknown
116,Improper Encoding or Escaping of Output,6511.818684141813,unknown
78,Improper Neutralization of Special Elements used in an OS Command ('OS Command Injection'),6460.181176749958,unknown
