cwe_id,name,score,search_source
88,Improper Neutralization of Argument Delimiters in a Command ('Argument Injection'),6705.682680783304,base_query
184,Incomplete List of Disallowed Inputs,6439.356382417723,base_query
116,Improper Encoding or Escaping of Output,6316.85901509465,base_query
95,Improper Neutralization of Directives in Dynamically Evaluated Code ('Eval Injection'),6316.159904273766,base_query
78,Improper Neutralization of Special Elements used in an OS Command ('OS Command Injection'),6239.1084577587135,base_query
