cwe_id,name,score,search_source
88,Improper Neutralization of Argument Delimiters in a Command ('Argument Injection'),7117.776091037984,base_query
1336,Improper Neutralization of Special Elements Used in a Template Engine,7078.098637672361,base_query
74,Improper Neutralization of Special Elements in Output Used by a Downstream Component ('Injection'),6784.8423655704855,base_query
138,Improper Neutralization of Special Elements,6764.487312096742,base_query
116,Improper Encoding or Escaping of Output,6740.219895637244,base_query
