cwe_id,name,score,search_source
1336,Improper Neutralization of Special Elements Used in a Template Engine,7851.601027633353,unknown
79,Improper Neutralization of Input During Web Page Generation ('Cross-site Scripting'),7741.718465060138,unknown
113,Improper Neutralization of CRLF Sequences in HTTP Headers ('HTTP Request/Response Splitting'),7696.173296764145,unknown
116,Improper Encoding or Escaping of Output,7406.094052269729,unknown
138,Improper Neutralization of Special Elements,7320.506350567443,unknown
