cwe_id,name,score,search_source
113,Improper Neutralization of CRLF Sequences in HTTP Headers ('HTTP Request/Response Splitting'),6771.636449148562,base_query
79,Improper Neutralization of Input During Web Page Generation ('Cross-site Scripting'),6683.931152195233,base_query
1336,Improper Neutralization of Special Elements Used in a Template Engine,6563.733060099693,base_query
116,Improper Encoding or Escaping of Output,6419.510929847854,base_query
138,Improper Neutralization of Special Elements,6378.016482463388,base_query
