cwe_id,name,score,search_source
79,Improper Neutralization of Input During Web Page Generation ('Cross-site Scripting'),8357.876963595882,base_query
113,Improper Neutralization of CRLF Sequences in HTTP Headers ('HTTP Request/Response Splitting'),8341.72482189971,base_query
138,Improper Neutralization of Special Elements,8230.374738077464,base_query
116,Improper Encoding or Escaping of Output,8087.826311472374,base_query
88,Improper Neutralization of Argument Delimiters in a Command ('Argument Injection'),7883.075215542557,base_query
