cwe_id,name,score,search_source
116,Improper Encoding or Escaping of Output,8826.262206843774,unknown
138,Improper Neutralization of Special Elements,8345.788378133975,unknown
88,Improper Neutralization of Argument Delimiters in a Command ('Argument Injection'),8248.701537344765,unknown
22,Improper Limitation of a Pathname to a Restricted Directory ('Path Traversal'),8215.90966583618,unknown
74,Improper Neutralization of Special Elements in Output Used by a Downstream Component ('Injection'),8100.67026263737,unknown
