cwe_id,name,score,search_source
1321,Improperly Controlled Modification of Object Prototype Attributes ('Prototype Pollution'),6269.351109982612,base_query
335,Incorrect Usage of Seeds in Pseudo-Random Number Generator (PRNG),6127.068278866607,base_query
639,Authorization Bypass Through User-Controlled Key,6074.858897489017,base_query
915,Improperly Controlled Modification of Dynamically-Determined Object Attributes,5807.522095281151,base_query
502,Deserialization of Untrusted Data,5579.586986839391,base_query
