cwe_id,name,score,search_source
88,Improper Neutralization of Argument Delimiters in a Command ('Argument Injection'),8066.711166277032,base_query
116,Improper Encoding or Escaping of Output,7979.447689217991,base_query
138,Improper Neutralization of Special Elements,7678.5574618935225,base_query
78,Improper Neutralization of Special Elements used in an OS Command ('OS Command Injection'),7519.445523139331,base_query
94,Improper Control of Generation of Code ('Code Injection'),7458.915066186814,base_query
