cwe_id,name,score,search_source
113,Improper Neutralization of CRLF Sequences in HTTP Headers ('HTTP Request/Response Splitting'),9246.267908973636,unknown
444,Inconsistent Interpretation of HTTP Requests ('HTTP Request/Response Smuggling'),8690.899763719248,unknown
79,Improper Neutralization of Input During Web Page Generation ('Cross-site Scripting'),8516.527182855938,unknown
138,Improper Neutralization of Special Elements,8204.23289607807,unknown
93,Improper Neutralization of CRLF Sequences ('CRLF Injection'),8129.242698911595,unknown
