cwe_id,name,score,search_source
88,Improper Neutralization of Argument Delimiters in a Command ('Argument Injection'),7291.549646447903,unknown
22,Improper Limitation of a Pathname to a Restricted Directory ('Path Traversal'),7289.595807736102,unknown
116,Improper Encoding or Escaping of Output,7225.9322788284,unknown
184,Incomplete List of Disallowed Inputs,7092.1313507452505,unknown
95,Improper Neutralization of Directives in Dynamically Evaluated Code ('Eval Injection'),7070.913383091361,unknown
