cwe_id,name,score,search_source
1336,Improper Neutralization of Special Elements Used in a Template Engine,6309.826649151775,unknown
95,Improper Neutralization of Directives in Dynamically Evaluated Code ('Eval Injection'),6119.177464025948,unknown
88,Improper Neutralization of Argument Delimiters in a Command ('Argument Injection'),6027.494799546501,unknown
94,Improper Control of Generation of Code ('Code Injection'),5996.6710464634125,unknown
116,Improper Encoding or Escaping of Output,5845.586213932148,unknown
