cwe_id,name,score,search_source
1321,Improperly Controlled Modification of Object Prototype Attributes ('Prototype Pollution'),6953.407386050586,unknown
88,Improper Neutralization of Argument Delimiters in a Command ('Argument Injection'),6932.749502878885,unknown
95,Improper Neutralization of Directives in Dynamically Evaluated Code ('Eval Injection'),6729.20143801726,unknown
94,Improper Control of Generation of Code ('Code Injection'),6551.676427044321,unknown
502,Deserialization of Untrusted Data,6507.345753295473,unknown
