cwe_id,name,score,search_source
1336,Improper Neutralization of Special Elements Used in a Template Engine,8866.001293444147,base_query
79,Improper Neutralization of Input During Web Page Generation ('Cross-site Scripting'),8710.591134807524,base_query
113,Improper Neutralization of CRLF Sequences in HTTP Headers ('HTTP Request/Response Splitting'),8691.286823297689,base_query
138,Improper Neutralization of Special Elements,8618.131968716481,base_query
116,Improper Encoding or Escaping of Output,8576.388626566228,base_query
