cwe_id,name,score,search_source
88,Improper Neutralization of Argument Delimiters in a Command ('Argument Injection'),7799.179626079624,base_query
116,Improper Encoding or Escaping of Output,7400.5973800236625,base_query
138,Improper Neutralization of Special Elements,7130.142083846674,base_query
78,Improper Neutralization of Special Elements used in an OS Command ('OS Command Injection'),6890.375677870138,base_query
93,Improper Neutralization of CRLF Sequences ('CRLF Injection'),6793.983534336282,base_query
