cwe_id,name,score,search_source
184,Incomplete List of Disallowed Inputs,6604.346313660499,base_query
88,Improper Neutralization of Argument Delimiters in a Command ('Argument Injection'),6600.8811665920275,base_query
95,Improper Neutralization of Directives in Dynamically Evaluated Code ('Eval Injection'),6592.725240308048,base_query
116,Improper Encoding or Escaping of Output,6511.818684141813,base_query
78,Improper Neutralization of Special Elements used in an OS Command ('OS Command Injection'),6460.181176749958,base_query
