cwe_id,name,score,search_source
88,Improper Neutralization of Argument Delimiters in a Command ('Argument Injection'),5814.819581772999,base_query
78,Improper Neutralization of Special Elements used in an OS Command ('OS Command Injection'),5386.806456709763,base_query
116,Improper Encoding or Escaping of Output,5364.729164273163,base_query
95,Improper Neutralization of Directives in Dynamically Evaluated Code ('Eval Injection'),5355.049700408857,base_query
138,Improper Neutralization of Special Elements,5334.2605552099985,base_query
