cwe_id,name,score,search_source
116,Improper Encoding or Escaping of Output,9265.933541880862,base_query
79,Improper Neutralization of Input During Web Page Generation ('Cross-site Scripting'),8975.365966682508,base_query
138,Improper Neutralization of Special Elements,8799.56832909354,base_query
1336,Improper Neutralization of Special Elements Used in a Template Engine,8753.054224227266,base_query
88,Improper Neutralization of Argument Delimiters in a Command ('Argument Injection'),8628.120194191964,base_query
