cwe_id,name,score,search_source
184,Incomplete List of Disallowed Inputs,7759.8099392953545,base_query
1336,Improper Neutralization of Special Elements Used in a Template Engine,7713.434538239196,base_query
22,Improper Limitation of a Pathname to a Restricted Directory ('Path Traversal'),7596.965386506677,base_query
88,Improper Neutralization of Argument Delimiters in a Command ('Argument Injection'),7587.85224432813,base_query
116,Improper Encoding or Escaping of Output,7559.964966134521,base_query
