cwe_id,name,score,search_source
113,Improper Neutralization of CRLF Sequences in HTTP Headers ('HTTP Request/Response Splitting'),9959.993282171898,unknown
116,Improper Encoding or Escaping of Output,9880.393255625318,unknown
444,Inconsistent Interpretation of HTTP Requests ('HTTP Request/Response Smuggling'),9746.291747564173,unknown
79,Improper Neutralization of Input During Web Page Generation ('Cross-site Scripting'),9699.35412367732,unknown
138,Improper Neutralization of Special Elements,9358.715531204556,unknown
