cwe_id,name,score,search_source
79,Improper Neutralization of Input During Web Page Generation ('Cross-site Scripting'),8914.185116619892,base_query
113,Improper Neutralization of CRLF Sequences in HTTP Headers ('HTTP Request/Response Splitting'),8767.62403035561,base_query
116,Improper Encoding or Escaping of Output,8525.301002495044,base_query
138,Improper Neutralization of Special Elements,8490.251858012592,base_query
88,Improper Neutralization of Argument Delimiters in a Command ('Argument Injection'),8457.895171678876,base_query
