cwe_id,name,score,search_source
79,Improper Neutralization of Input During Web Page Generation ('Cross-site Scripting'),8115.438503931809,base_query
116,Improper Encoding or Escaping of Output,8110.949163431224,base_query
138,Improper Neutralization of Special Elements,7542.007733746844,base_query
80,Improper Neutralization of Script-Related HTML Tags in a Web Page (Basic XSS),7406.578977799379,base_query
113,Improper Neutralization of CRLF Sequences in HTTP Headers ('HTTP Request/Response Splitting'),7386.568711547385,base_query
