cwe_id,name,score,search_source
79,Improper Neutralization of Input During Web Page Generation ('Cross-site Scripting'),7403.02963561136,base_query
1336,Improper Neutralization of Special Elements Used in a Template Engine,7064.9462554641705,base_query
116,Improper Encoding or Escaping of Output,6987.536687825808,base_query
434,Unrestricted Upload of File with Dangerous Type,6893.252591950894,base_query
22,Improper Limitation of a Pathname to a Restricted Directory ('Path Traversal'),6847.203313598564,base_query
