cwe_id,name,score,search_source
116,Improper Encoding or Escaping of Output,9014.93399574161,unknown
79,Improper Neutralization of Input During Web Page Generation ('Cross-site Scripting'),8885.163134520504,unknown
138,Improper Neutralization of Special Elements,8784.027248197357,unknown
88,Improper Neutralization of Argument Delimiters in a Command ('Argument Injection'),8632.396189815274,unknown
22,Improper Limitation of a Pathname to a Restricted Directory ('Path Traversal'),8531.715789262558,unknown
