cwe_id,name,score,search_source
79,Improper Neutralization of Input During Web Page Generation ('Cross-site Scripting'),8555.251898212146,unknown
113,Improper Neutralization of CRLF Sequences in HTTP Headers ('HTTP Request/Response Splitting'),8437.9209727769,unknown
88,Improper Neutralization of Argument Delimiters in a Command ('Argument Injection'),8335.144013422503,unknown
116,Improper Encoding or Escaping of Output,8320.213490318532,unknown
138,Improper Neutralization of Special Elements,8194.515275564898,unknown
