cwe_id,name,score,search_source
116,Improper Encoding or Escaping of Output,9580.851503061815,unknown
79,Improper Neutralization of Input During Web Page Generation ('Cross-site Scripting'),9254.571330073632,unknown
138,Improper Neutralization of Special Elements,8977.593363118267,unknown
22,Improper Limitation of a Pathname to a Restricted Directory ('Path Traversal'),8800.96359764872,unknown
88,Improper Neutralization of Argument Delimiters in a Command ('Argument Injection'),8716.477482468601,unknown
