cwe_id,name,score,search_source
79,Improper Neutralization of Input During Web Page Generation ('Cross-site Scripting'),7970.65910106293,base_query
116,Improper Encoding or Escaping of Output,7879.19129624275,base_query
138,Improper Neutralization of Special Elements,7868.723375629351,base_query
88,Improper Neutralization of Argument Delimiters in a Command ('Argument Injection'),7683.281923882836,base_query
94,Improper Control of Generation of Code ('Code Injection'),7664.691109423868,base_query
