cwe_id,name,score,search_source
116,Improper Encoding or Escaping of Output,9194.051034504488,base_query
79,Improper Neutralization of Input During Web Page Generation ('Cross-site Scripting'),9157.024005678679,base_query
138,Improper Neutralization of Special Elements,9031.001861320368,base_query
1336,Improper Neutralization of Special Elements Used in a Template Engine,9019.939214564896,base_query
22,Improper Limitation of a Pathname to a Restricted Directory ('Path Traversal'),8691.264970344888,base_query
