cwe_id,name,score,search_source
79,Improper Neutralization of Input During Web Page Generation ('Cross-site Scripting'),7686.4543648710705,base_query
1336,Improper Neutralization of Special Elements Used in a Template Engine,7507.104769449328,base_query
116,Improper Encoding or Escaping of Output,7393.318094761758,base_query
502,Deserialization of Untrusted Data,7276.652001978384,base_query
917,Improper Neutralization of Special Elements used in an Expression Language Statement ('Expression Language Injection'),7190.618893870236,base_query
