cwe_id,name,score,search_source
113,Improper Neutralization of CRLF Sequences in HTTP Headers ('HTTP Request/Response Splitting'),8001.162496447557,base_query
79,Improper Neutralization of Input During Web Page Generation ('Cross-site Scripting'),7934.812965584061,base_query
22,Improper Limitation of a Pathname to a Restricted Directory ('Path Traversal'),7679.13111856343,base_query
116,Improper Encoding or Escaping of Output,7651.58316672926,base_query
138,Improper Neutralization of Special Elements,7601.525495541127,base_query
