cwe_id,name,score,search_source
113,Improper Neutralization of CRLF Sequences in HTTP Headers ('HTTP Request/Response Splitting'),8903.712007010894,base_query
79,Improper Neutralization of Input During Web Page Generation ('Cross-site Scripting'),8821.789018000887,base_query
22,Improper Limitation of a Pathname to a Restricted Directory ('Path Traversal'),8427.3560447612,base_query
138,Improper Neutralization of Special Elements,8397.473969153287,base_query
611,Improper Restriction of XML External Entity Reference,8383.866969416666,base_query
