cwe_id,name,score,search_source
88,Improper Neutralization of Argument Delimiters in a Command ('Argument Injection'),7275.803303472354,base_query
1336,Improper Neutralization of Special Elements Used in a Template Engine,7044.302516584157,base_query
22,Improper Limitation of a Pathname to a Restricted Directory ('Path Traversal'),6807.048205069563,base_query
95,Improper Neutralization of Directives in Dynamically Evaluated Code ('Eval Injection'),6720.766294663311,base_query
502,Deserialization of Untrusted Data,6720.3686330839655,base_query
