cwe_id,name,score,search_source
79,Improper Neutralization of Input During Web Page Generation ('Cross-site Scripting'),8166.594409511931,unknown
611,Improper Restriction of XML External Entity Reference,8123.315615797456,unknown
22,Improper Limitation of a Pathname to a Restricted Directory ('Path Traversal'),8063.496008416139,unknown
1336,Improper Neutralization of Special Elements Used in a Template Engine,7921.880991076148,unknown
184,Incomplete List of Disallowed Inputs,7814.859977073371,unknown
