cwe_id,name,score,search_source
88,Improper Neutralization of Argument Delimiters in a Command ('Argument Injection'),7356.662725404213,base_query
116,Improper Encoding or Escaping of Output,7298.722048538836,base_query
95,Improper Neutralization of Directives in Dynamically Evaluated Code ('Eval Injection'),6890.011617479242,base_query
138,Improper Neutralization of Special Elements,6816.940043115681,base_query
94,Improper Control of Generation of Code ('Code Injection'),6815.669177539064,base_query
