cwe_id,name,score,search_source
116,Improper Encoding or Escaping of Output,9098.456414736964,base_query
79,Improper Neutralization of Input During Web Page Generation ('Cross-site Scripting'),8850.47387949804,base_query
138,Improper Neutralization of Special Elements,8742.360127213313,base_query
88,Improper Neutralization of Argument Delimiters in a Command ('Argument Injection'),8672.940157866258,base_query
1336,Improper Neutralization of Special Elements Used in a Template Engine,8633.64718575626,base_query
