cwe_id,name,score,search_source
88,Improper Neutralization of Argument Delimiters in a Command ('Argument Injection'),7292.596951789207,base_query
113,Improper Neutralization of CRLF Sequences in HTTP Headers ('HTTP Request/Response Splitting'),7241.488508204503,base_query
138,Improper Neutralization of Special Elements,7015.298187485706,base_query
95,Improper Neutralization of Directives in Dynamically Evaluated Code ('Eval Injection'),6989.95693281339,base_query
93,Improper Neutralization of CRLF Sequences ('CRLF Injection'),6949.2234104018125,base_query
