cwe_id,name,score,search_source
184,Incomplete List of Disallowed Inputs,6393.54379917238,base_query
88,Improper Neutralization of Argument Delimiters in a Command ('Argument Injection'),6317.899248587847,base_query
22,Improper Limitation of a Pathname to a Restricted Directory ('Path Traversal'),6285.719065280684,base_query
78,Improper Neutralization of Special Elements used in an OS Command ('OS Command Injection'),6252.4335431933105,base_query
116,Improper Encoding or Escaping of Output,6098.600591227143,base_query
