cwe_id,name,score,search_source
116,Improper Encoding or Escaping of Output,8785.105497195324,base_query
79,Improper Neutralization of Input During Web Page Generation ('Cross-site Scripting'),8588.652616224328,base_query
138,Improper Neutralization of Special Elements,8487.87006867167,base_query
88,Improper Neutralization of Argument Delimiters in a Command ('Argument Injection'),8210.167497333425,base_query
94,Improper Control of Generation of Code ('Code Injection'),8100.696910412074,base_query
