cwe_id,name,score,search_source
444,Inconsistent Interpretation of HTTP Requests ('HTTP Request/Response Smuggling'),8479.180753715136,unknown
113,Improper Neutralization of CRLF Sequences in HTTP Headers ('HTTP Request/Response Splitting'),8282.424724009728,unknown
79,Improper Neutralization of Input During Web Page Generation ('Cross-site Scripting'),7909.89873413569,unknown
441,Unintended Proxy or Intermediary ('Confused Deputy'),7805.2774416375105,unknown
923,Improper Restriction of Communication Channel to Intended Endpoints,7799.965036174296,unknown
