cwe_id,name,score,search_source
113,Improper Neutralization of CRLF Sequences in HTTP Headers ('HTTP Request/Response Splitting'),7748.695621911493,base_query
79,Improper Neutralization of Input During Web Page Generation ('Cross-site Scripting'),7618.564389798513,base_query
1336,Improper Neutralization of Special Elements Used in a Template Engine,7441.986183737275,base_query
611,Improper Restriction of XML External Entity Reference,7332.388025730369,base_query
116,Improper Encoding or Escaping of Output,7265.4039884718,base_query
