cwe_id,name,type,score
99,Improper Control of Resource Identifiers ('Resource Injection'),Class,0.7681185411475118
405,Asymmetric Resource Consumption (Amplification),Class,0.7564756408751169
74,Improper Neutralization of Special Elements in Output Used by a Downstream Component ('Injection'),Class,0.7519154938277668
664,Improper Control of a Resource Through its Lifetime,Pillar,0.7472600656682228
913,Improper Control of Dynamically-Managed Code Resources,Class,0.7468303255696713
226,Sensitive Information in Resource Not Removed Before Reuse,Base,0.7462229228904251
915,Improperly Controlled Modification of Dynamically-Determined Object Attributes,Base,0.7454099595075724
653,Improper Isolation or Compartmentalization,Class,0.742677169066644
1289,Improper Validation of Unsafe Equivalence in Input,Base,0.7401315747536197
799,Improper Control of Interaction Frequency,Class,0.7397443290463556
