cwe_id,name,type,score
404,Improper Resource Shutdown or Release,Class,0.8198576863059496
226,Sensitive Information in Resource Not Removed Before Reuse,Base,0.795356936207858
366,Race Condition within a Thread,Base,0.782012513036118
667,Improper Locking,Class,0.7727391352591609
772,Missing Release of Resource after Effective Lifetime,Base,0.7658815448921433
662,Improper Synchronization,Class,0.7613356676365428
362,Concurrent Execution using Shared Resource with Improper Synchronization ('Race Condition'),Class,0.75367138383971
664,Improper Control of a Resource Through its Lifetime,Pillar,0.7534280641287994
826,Premature Release of Resource During Expected Lifetime,Base,0.7509361307471649
367,Time-of-check Time-of-use (TOCTOU) Race Condition,Base,0.7405982064592368
