cwe_id,name,type,score
80,Improper Neutralization of Script-Related HTML Tags in a Web Page (Basic XSS),Variant,0.7862475434502185
74,Improper Neutralization of Special Elements in Output Used by a Downstream Component ('Injection'),Class,0.7798398075616645
838,Inappropriate Encoding for Output Context,Base,0.7617099998603986
116,Improper Encoding or Escaping of Output,Class,0.7604481004405481
138,Improper Neutralization of Special Elements,Class,0.7599322114116593
184,Incomplete List of Disallowed Inputs,Base,0.7585184846901591
1289,Improper Validation of Unsafe Equivalence in Input,Base,0.7531897101444587
917,Improper Neutralization of Special Elements used in an Expression Language Statement ('Expression Language Injection'),Base,0.7503784024940232
134,Use of Externally-Controlled Format String,Base,0.743853805593534
611,Improper Restriction of XML External Entity Reference,Base,0.7408688636981168
