cwe_id,name,type,score
667,Improper Locking,Class,0.7817073231575231
404,Improper Resource Shutdown or Release,Class,0.7792640811512417
1021,Improper Restriction of Rendered UI Layers or Frames,Base,0.7786643203561296
451,User Interface (UI) Misrepresentation of Critical Information,Class,0.7739247347949932
754,Improper Check for Unusual or Exceptional Conditions,Class,0.7650531682362824
668,Exposure of Resource to Wrong Sphere,Class,0.7633961391663593
1289,Improper Validation of Unsafe Equivalence in Input,Base,0.763311881948605
226,Sensitive Information in Resource Not Removed Before Reuse,Base,0.762536777942366
362,Concurrent Execution using Shared Resource with Improper Synchronization ('Race Condition'),Class,0.7578393423309917
653,Improper Isolation or Compartmentalization,Class,0.7552815808693953
