cwe_id,name,type,score
917,Improper Neutralization of Special Elements used in an Expression Language Statement ('Expression Language Injection'),Base,0.7704003176901781
74,Improper Neutralization of Special Elements in Output Used by a Downstream Component ('Injection'),Class,0.737473817561503
470,Use of Externally-Controlled Input to Select Classes or Code ('Unsafe Reflection'),Base,0.7303493061224647
1289,Improper Validation of Unsafe Equivalence in Input,Base,0.7253050264420591
184,Incomplete List of Disallowed Inputs,Base,0.725027606832571
80,Improper Neutralization of Script-Related HTML Tags in a Web Page (Basic XSS),Variant,0.7162498299048516
73,External Control of File Name or Path,Base,0.7153149000815624
138,Improper Neutralization of Special Elements,Class,0.7120552232669931
1336,Improper Neutralization of Special Elements Used in a Template Engine,Base,0.7115908855389398
943,Improper Neutralization of Special Elements in Data Query Logic,Class,0.7115756867024265
