cwe_id,name,type,score
74,Improper Neutralization of Special Elements in Output Used by a Downstream Component ('Injection'),Class,0.7764055473463392
80,Improper Neutralization of Script-Related HTML Tags in a Web Page (Basic XSS),Variant,0.7612874907670117
917,Improper Neutralization of Special Elements used in an Expression Language Statement ('Expression Language Injection'),Base,0.7541804412888303
838,Inappropriate Encoding for Output Context,Base,0.7527734980269396
184,Incomplete List of Disallowed Inputs,Base,0.7489794213439203
138,Improper Neutralization of Special Elements,Class,0.7487718667541169
116,Improper Encoding or Escaping of Output,Class,0.7449099762586442
1289,Improper Validation of Unsafe Equivalence in Input,Base,0.7428823988133318
88,Improper Neutralization of Argument Delimiters in a Command ('Argument Injection'),Base,0.7410242525208
134,Use of Externally-Controlled Format String,Base,0.7410067145746413
