cwe_id,name,type,score
74,Improper Neutralization of Special Elements in Output Used by a Downstream Component ('Injection'),Class,0.7763412347032691
943,Improper Neutralization of Special Elements in Data Query Logic,Class,0.7635241812026949
184,Incomplete List of Disallowed Inputs,Base,0.7627669518362684
80,Improper Neutralization of Script-Related HTML Tags in a Web Page (Basic XSS),Variant,0.7564571956318079
1289,Improper Validation of Unsafe Equivalence in Input,Base,0.7561551893795402
917,Improper Neutralization of Special Elements used in an Expression Language Statement ('Expression Language Injection'),Base,0.7483161706680073
138,Improper Neutralization of Special Elements,Class,0.7472169336271828
807,Reliance on Untrusted Inputs in a Security Decision,Base,0.7382911661134057
116,Improper Encoding or Escaping of Output,Class,0.7375197210672014
41,Improper Resolution of Path Equivalence,Base,0.735810115772335
