cwe_id,name,type,score
404,Improper Resource Shutdown or Release,Class,0.8048702848503054
226,Sensitive Information in Resource Not Removed Before Reuse,Base,0.8022031704639797
667,Improper Locking,Class,0.7950700214013565
653,Improper Isolation or Compartmentalization,Class,0.7787675561167728
754,Improper Check for Unusual or Exceptional Conditions,Class,0.7746550559348733
668,Exposure of Resource to Wrong Sphere,Class,0.7714005846759238
362,Concurrent Execution using Shared Resource with Improper Synchronization ('Race Condition'),Class,0.7697150785923172
665,Improper Initialization,Class,0.7696873861960756
119,Improper Restriction of Operations within the Bounds of a Memory Buffer,Class,0.7695724765798465
909,Missing Initialization of Resource,Class,0.7687899460773817
