cwe_id,name,type,score
917,Improper Neutralization of Special Elements used in an Expression Language Statement ('Expression Language Injection'),Base,0.7697271192031956
74,Improper Neutralization of Special Elements in Output Used by a Downstream Component ('Injection'),Class,0.76353367875877
184,Incomplete List of Disallowed Inputs,Base,0.7534957618172757
1289,Improper Validation of Unsafe Equivalence in Input,Base,0.7511954767956388
138,Improper Neutralization of Special Elements,Class,0.742028889491357
80,Improper Neutralization of Script-Related HTML Tags in a Web Page (Basic XSS),Variant,0.7417250502134078
807,Reliance on Untrusted Inputs in a Security Decision,Base,0.7353261439857567
943,Improper Neutralization of Special Elements in Data Query Logic,Class,0.7346796253045103
99,Improper Control of Resource Identifiers ('Resource Injection'),Class,0.7314467977165786
1286,Improper Validation of Syntactic Correctness of Input,Base,0.7287963401764773
