cwe_id,name,type,score
404,Improper Resource Shutdown or Release,Class,0.7891942425209255
226,Sensitive Information in Resource Not Removed Before Reuse,Base,0.7750929082027165
667,Improper Locking,Class,0.7628644755000301
366,Race Condition within a Thread,Base,0.7567205774748393
668,Exposure of Resource to Wrong Sphere,Class,0.7565361957062385
754,Improper Check for Unusual or Exceptional Conditions,Class,0.7531240280361724
356,Product UI does not Warn User of Unsafe Actions,Base,0.7520560131166288
703,Improper Check or Handling of Exceptional Conditions,Pillar,0.7517357712933022
131,Incorrect Calculation of Buffer Size,Base,0.7504032542049603
1289,Improper Validation of Unsafe Equivalence in Input,Base,0.7480535166925181
