cwe_id,name,type,score
266,Incorrect Privilege Assignment,Base,0.7450428910602599
639,Authorization Bypass Through User-Controlled Key,Base,0.7427143553386109
668,Exposure of Resource to Wrong Sphere,Class,0.7409402420854472
267,Privilege Defined With Unsafe Actions,Base,0.7406448800895891
274,Improper Handling of Insufficient Privileges,Base,0.7327301756568296
280,Improper Handling of Insufficient Permissions or Privileges ,Base,0.7319322605480413
653,Improper Isolation or Compartmentalization,Class,0.7306305485577018
1390,Weak Authentication,Class,0.726017120364916
41,Improper Resolution of Path Equivalence,Base,0.7245665819548316
1220,Insufficient Granularity of Access Control,Base,0.7236584750040285
