cwe_id,name,type,score
1236,Improper Neutralization of Formula Elements in a CSV File,Base,0.8124956837520266
74,Improper Neutralization of Special Elements in Output Used by a Downstream Component ('Injection'),Class,0.7533366319770911
184,Incomplete List of Disallowed Inputs,Base,0.7352822439386107
138,Improper Neutralization of Special Elements,Class,0.7328598561440048
943,Improper Neutralization of Special Elements in Data Query Logic,Class,0.7314967728434922
917,Improper Neutralization of Special Elements used in an Expression Language Statement ('Expression Language Injection'),Base,0.729222866669018
80,Improper Neutralization of Script-Related HTML Tags in a Web Page (Basic XSS),Variant,0.7230518654432107
116,Improper Encoding or Escaping of Output,Class,0.7226435126807224
88,Improper Neutralization of Argument Delimiters in a Command ('Argument Injection'),Base,0.7217712857231173
1289,Improper Validation of Unsafe Equivalence in Input,Base,0.7141608200075475
