cwe_id,name,type,score
74,Improper Neutralization of Special Elements in Output Used by a Downstream Component ('Injection'),Class,0.7669849802418207
917,Improper Neutralization of Special Elements used in an Expression Language Statement ('Expression Language Injection'),Base,0.7438546375458291
184,Incomplete List of Disallowed Inputs,Base,0.7426354604875347
138,Improper Neutralization of Special Elements,Class,0.7414859684202195
80,Improper Neutralization of Script-Related HTML Tags in a Web Page (Basic XSS),Variant,0.7393346158480492
807,Reliance on Untrusted Inputs in a Security Decision,Base,0.7386029235959637
943,Improper Neutralization of Special Elements in Data Query Logic,Class,0.7373553380076104
1289,Improper Validation of Unsafe Equivalence in Input,Base,0.7372564865662031
1236,Improper Neutralization of Formula Elements in a CSV File,Base,0.7348391349095584
707,Improper Neutralization,Pillar,0.7314906455294573
