cwe_id,name,type,score
404,Improper Resource Shutdown or Release,Class,0.7774622936687143
664,Improper Control of a Resource Through its Lifetime,Pillar,0.7757320220999092
754,Improper Check for Unusual or Exceptional Conditions,Class,0.7706553732065429
703,Improper Check or Handling of Exceptional Conditions,Pillar,0.7673904315173736
226,Sensitive Information in Resource Not Removed Before Reuse,Base,0.7610685181024975
1289,Improper Validation of Unsafe Equivalence in Input,Base,0.7549404457326705
606,Unchecked Input for Loop Condition,Base,0.7523665665045027
405,Asymmetric Resource Consumption (Amplification),Class,0.7517822253265231
691,Insufficient Control Flow Management,Pillar,0.7421906955099458
274,Improper Handling of Insufficient Privileges,Base,0.7407715873827819
