cwe_id,name,type,score,relationship_count
79,Improper Neutralization of Input During Web Page Generation ('Cross-site Scripting'),base,3.7206,0
202,Exposure of Sensitive Information Through Data Queries,base,3.6399999999999997,0
201,Insertion of Sensitive Information Into Sent Data,base,3.6399999999999997,0
209,Generation of Error Message Containing Sensitive Information,base,3.6399999999999997,0
917,Improper Neutralization of Special Elements used in an Expression Language Statement ('Expression Language Injection'),base,3.6399999999999997,0
1289,Improper Validation of Unsafe Equivalence in Input,base,3.6399999999999997,0
1336,Improper Neutralization of Special Elements Used in a Template Engine,base,3.6399999999999997,0
178,Improper Handling of Case Sensitivity,base,3.6399999999999997,0
611,Improper Restriction of XML External Entity Reference,base,3.6399999999999997,0
73,External Control of File Name or Path,base,3.3566,0
